comentario,polaridade
Tenho score altíssimo e crédito em outros bancos.cartões. mas vocês não aumenta meu limite. me deixa refém do cartão do Bancão... Quando preciso comprar passagens aéreas. por exemplo. acabo recorrendo ao outro. Sinceramente? Só não desisti ainda por causa da Nuconta e da função débito.,negativo
Sempre que precisei fui atendida . Obg @nubank ??????,positivo
@foxliiv,neutro
Aumenta o meu. por favor. já tô cansado de pedir no app ??,negativo
Tô pedindo a tempo para aumentar e não consigo poxa vida. tem.uma amiga que tem.mais que eu e ganha menos que eu muito difícil,negativo
Já tenho o meu 5 anos quando peço aumento nunca consigo pago em dia além tinterdição varios amigos para terem nubank hoje todos amigos e colegas de trabalho tem nubank??,negativo
@nubank aprova meu cartão!!!????????,neutro
????????????????,neutro
Comecei com 600. Agora já estou com 1800. Tô torcendo pra que aumente mais um pouquinho pra eu poder montar meu computador ????,positivo
Sempre tive um bom relacionamento com o Nubank. concentrando a maioria dos meus gastos no roxinho e sempre o aumento de limite acompanhava meu consumo. Porém chegou um patamar que usava todo o crédito e não conseguia mais aumentar o limite. tendo que recorrer ao meu cartão do banco. Como em bancos tradicionais o aumento de limite é mais simplificado. de acordo com o consumo. acabei que passei a concentrar todos os meus gastos mensais no meu cartão do banco onde recebo meu salário. Passei a deixar o limite que tenho no Nubank para compras de emergência ou viagens. Adoraria que o limite do meu roxinho acompanhasse meu consumo. e olha que meu score no Serasa está beirando 900. porém por comodidade de usar apenas um cartão durante o mês tive que voltar para o banco tradicional ??.,negativo
??,neutro
Tbm qro nu. aumenta ai??,neutro
The best of the world!!!!??????,positivo
isso que diferencia vocês dos outros. vocês não são só um banco vocês são uma escola de educação financeira. muita gente não tem controle financeiro e acham que limite alto é dinheiro no bolso. ao contrário do que acham vocês estão é os educando.,positivo
Estou na primeira Fatura que ainda não fecho. estou gostando muito do roxinho ????????@nubank,positivo
Eu amo um cartão ??,positivo
Não estou conseguindo aumentar meu limite ??.,neutro
Pago as vezes bem antes do vencimento já solicitei aumento é nada. o nubank vc sabe meu ?? e de vcs aumenta si vai ????,negativo
Pelo amor de Deus não me dê limite não. se não gasto tudo.,neutro
Vão me desculpar mas essa explicação não cola né. Todo mês uso todo meu limite. Antecipo faturas. gasto e toda vez as mesmas respostas automáticas. Já antecipei em 1 mês 3x o valor da minha fatura. vai entender né. ??????????????,negativo
Sempre pago a fatura antes do vencimento e ate hj nunca aumentaram meu limite ??,negativo
Por favor me responda no direct. está demorando muito ??,negativo
@ithayres_modesto,neutro
@nubank acho melhor não colocarmos limites. e quanto atingir o limite. vocês dobram o nosso limite ??,neutro
Todo mês eu uso todo o limite do crédito. sempre pago uns 7 dias antes. E nuncaaaa aumentaram o limite do meu cartão! Tô quase cancelando. sinceramente!,negativo
Acredito que a questão não está no cliente. Mas na limitação do próprio Nubank. Meu limite no banco Inter é maior. O limite do Nubank é menos que 10% do limite que tenho no cartão do meu banco. Por isso não dá pra abandonar o banco. Crédito muito limitado do Nubank.,negativo
@marinadfurtado,neutro
Esse cartão é muito bom ???????? mas poderia vim com um limite de acordo com a renda. Inclusive concentro uma parte do que ganho na nuconta. daí já dava pra aumentar o limite.,positivo
SÓ EU QUE NÃO CONSIGO FAZER ESSE CARTÃO. ???????? @nubank,negativo
Eu estou aguardando o meu limite aumentar em breve??????,neutro
Amoo meu nubank! Estou muito satisfeita! ????,positivo
Queria que ao menos o meu fosse aprovado. pra eu me livrar da anuidade do master.,neutro
Existe o feedback com o Serasa? Eles consultam o pagamento Nubank para aumento do Score?,neutro
Eu ja quis cancelar demoram muito pra aumentar meu limite,negativo
Já solicitei aumento umas 10. porém sem sucesso. meu limite atual é 1150. tenho outro cartão com limite de 3 mil. quero sair dele porém ficar com esse limite de 1150 é muito pouco pra mim. estou tentando com o Inter caso consiga ficarei apenas cm ele e sairei do Nubank e do sicoob que tenho,negativo
Estou  presidindo  de  mais  limite  espero  que  o mesmo  possa  ser aumentado .,neutro
@nubank limite eu tenho. não tenho é dinheiro pra pagar kekekekke,neutro
@itsmegregorio,neutro
Faço tudo isso e mesmo assim nada de aumento ?? ajudai @nubank,negativo
Uso super bem o meu limite e pago sempre em dia. mas nunca aumentam meu limite ??????,negativo
Banco bosta mais de 1 ano pago adiantado as faturas já gasto tem mais o triplo do meu limite não aumenta vou quebrar essa bosta ??,negativo
Tenho o roxinho a 2 anos e nunca aumentou limite já tentei muitas vezes e nada . tenho a conta e pontos !,negativo
@gustavojorg,neutro
Nubank me da um ps4 de presente. ai eu paro de pedir aumento de limite eu juro ????????,neutro
To com o meu desde fevereiro comecei com 400 agora to com 1850 ??,positivo
@maciel10magalhaes,neutro
Eu que o meu,neutro
@nubank vamos conversar sobre os meus débitos... me chama no direct ??,neutro
Só tenho a agradecer a @nubank esse ano faço 3 anos que estou com a nú. me deram um limite inicial de 2.850.00 e hoje estou com 6.600.00 e rumo ao meu 10k de limite!,positivo
Concordo plenamente. comecei com um limite de 950. hoje já tenho 1.800  para mim está ótimo... É bom que não gasto muito e mesmo que vejo lá que tenho mais limite disponível não uso... Adoro o Nubank  literalmente me ajuda muito. mudou minha vida financeira ????,positivo
Vão abrir o capital quando?,neutro
Deus me livre mais quem me dera!??????,neutro
Gente demora muito pra liberar o crédito tenho só débito,neutro
O meu tá alto. mas eu não estou usando muito. estou esperando pagar uma coisa pra depois gastar com outra ??,neutro
Não faz isso comigo mais????????,neutro
Parabéns pra quem tem algum limite por menor que seja.tem a expectativa de aumentar conforme o uso do cartão.Pior sou eu que movimento minha Nuconta o tempo todo e com valores que variam entre 1.800 a 2mil todo mês no débito e nunca recebi 1 centavo de crédito.só promessas.e uma tal de fila de espera eterna...??,negativo
Gente vocês são demais! É muito difícil conseguir explicar isso para a pessoa que quer o aumento de limite. Geralmente a pessoa fica brava achando que é má vontade de quem está atendendo. E com um texto simples. vocês conseguiram explicar direitinho como funciona a questão de limites. não só no Nu mas no mundo de cartões. \o,positivo
Isso Nubank. por favor. NÃO aumente meu limite hahahaha,neutro
Melhor cartão. não troco meu roxinho ?????? já aumentou meu limite duas vezes!!,positivo
Essa arte ficou demais. parabéns @nubank,positivo
Estou a uns dois anos com o limite sem aumento. uso mais 2 cartões para suprir. por mim direcionava tudo para o Nubank. mas não tem como :(,negativo
Gosto muito do meu cartão Nubank. Foi a única que aprovou meu nome para o cartão. me deram um bom limite e posso controlar tudo dele pelo app. Já até reduzi meu limite pra num gastar demais. Vale muito a pena.,positivo
Tenho uma dúvida... Tenho cartão de débito nubank. porém o cartão de crédito não foi aprovado. Como posso saber. se já estou no momento de tentar novamente obter o cartão de crédito ? Eu sou avisado?,neutro
Tá certissimo.???????? As vezes a gente se empolga e estoura o limite .depois não consegue pagar e se Dana tudo.  O limite do meu é pouco.mas tá bom .dá pra eu comprar lanche e conseguir pagar depois ????????????????,positivo
É o melhor cartão que existe! ??,positivo
Eu faço tudo isso e nunca aumentou ??,negativo
Já vi o link da bio e também já fiz tudo q esta descrito no post. mas aumento de limite q é bom... nem td é perfeito. ???????,negativo
Tudo mentira faz tempo que compro e nunca aumentam e outra coisa mesmo que a pessoa atrase dois ou três dias nao acho que seja motivo pra atrasar pq paga de todo jeito mesmo.,negativo
Eu gostaria de mais limite. mas acredito que devido a um parcelamento de uma parte da fatura no início do ano não consigo mais. Sendo que uso o nubank como principal e tbm a nuconta ??,negativo
Papo furado! Mais de 1 ano que pago antecipado minhas parcelas e algumas vezes chego a gastar 5 vezes o valor do meu limite em um mês. sem nunca atrasar 1 real! Já mandei comprovante de renda. fiz cadastro positivo no Serasa quando ainda não era obrigatório. e cansei de ter novo limite negado pelo @nubank estou seriamente pensando em parar de usar o cartão,negativo
os cara chorando por limite... Nubank n libera nem o cartão p mim po,neutro
Tenho cartão nubank há anos. tanto que já estou em meu 2o cartão. sempre paguei antecipado ou em dia e mesmo assim nunca aumentaram meu limite. mesmo com solicitações. entretanto. minha noiva que entrou bem depois por meu convite. vive tendo o limite aumentado haha. vai entender nubank... ¯\_( ?° ??°)_.¯,negativo
@simonetonezer,neutro
O meu nunca. e todo mês adianto mais de 300% do meu limite. esse mês mesmo adiantei 700% do meu minúsculo limite....por isso não posso concentrar meus gastos...e tenho de manter outras contas no Sicoob e Caixa.,negativo
O céu é o limite,neutro
@daianesmaia,neutro
@mtsrufino,neutro
Se bem que sou NuBank a mais de 2 anos e nunca consegui aumentar 1 real de limite ??... Inclusive sempre em dia com as faturas :.,negativo
Nubank é o melhor cartão de todos. apoio perfeito. fácil entendimento. transparência. atendimento muito bom. confiança muito grande que tenho. pretendo manter por varios anos ????????,positivo
Como posso tentar fazer o meu?,neutro
Não aprovaram nem meu cartão de crédito ??????? @nubank,negativo
@fernandoeduardorosa.fr,neutro
Muito decepcionada com Esse cartão.  @nubank  meu nome limpo sem restrições e nunca é aprovado.,negativo
@ellyssalima_,neutro
@didichaves_,neutro
@carla_sango,neutro
De fato o cartão Nubank é o mais difícil de conseguir aumento de limite. que eu já vi em toda a minha vida. Qualquer outro cartão de crédito aumenta o limite até sem pedir. como por exemplo Santander. Itaú e etc... Eu gostaria de um limite maior no Nubank pra eu ficar só com ele e cancelar os outros cartões de crédito que tenho.  Seria bom pra mim pq aí ao invés de eu pagar 3 faturas todo mês. pagaria só 1 . Mas paciência né rsrs,negativo
Não vejo isso não meu limite e muito baixo e já pedir mil vezes aumento??,negativo
Não tem outro que chegue nem perto da qualidade dos serviços de vcs. @nubank ?? Vcs estão de parabéns! Continuem melhorando e crescendo! ??????,positivo
Só queria um aumento temporário pra poder conhecer os caras do Metallica e não consegui ????,negativo
É por isso. que amo a Nubank.... sempre preocupados com seus Nyclientes kkkkk ?? Agora aumenta meu limite!!! ??,positivo
Como faço para ter um cartão?,neutro
Faço isso sempre pago 5 dias antes a pelo menos 2 anos e vcs nunca aumentam,negativo
Como eu exploro 50.00 de limite? Só a tristeza ??kkkkk,negativo
@nubank acabei de explorar bem meu limite atual. Aumenta meu limite! Nunca te pedi nada??,neutro
Meu pai tem um. o limite aumentou rapidinho. ????????,positivo
Não sei usar a nuconta ?? alguém pode mim ajudar ???,neutro
Tem um mês que eu recebi o cartão @nubank e o meu limite foi de 600 reais. Queria um valor mais alto #nubank,neutro
Aumenta o meu aí. ??,neutro
Já tentei várias vezes já recebi convite até hj nada desse cartão,negativo
Qnd vc não consegue fazer o cartão ??,neutro
Eu achei foi ruim por terem aumentado o meu kkkkkkkk,neutro
O meu não aumenta o limite ainda é 800.00 eu nunca atrasei sempre pago direitinho. e quando eu vou passar 50 centavos a mais eles não autorizam,negativo
O meu tem mais de 2 anos que não consigo aumentar meu limite @nubank  me ajudem por favor,negativo
Já tenho a conta.... esperando liberar o cartão,neutro
É esse cartão  e maravilhoso  faço minhas compras só  com ele. e  pago sempre em dia. Muito feliz!,positivo
Cara. eu amo um cartão de crédito que em breve será o maior banco do Brasil ??????,positivo
Comecei com 750 de limite ainda na época de universitário com renda limitada...Hoje to com 1K . porém . já estou com uma renda melhor e queria aumentar ?? #MeAjudaNubank @nubank :(,negativo
Tô esperando tb aumento do limite,neutro
Na verdade. quando o Nubank não aumenta a tendência é procurar outros bancos que venham com um limite bom. Eu pago meu cartão em dias. mas o limite tá me deixando frustrado com o cartão. Ele é muito bom. mas poderia vim com um limite de acordo com minha renda que eu já até comprovei.,negativo
Nubank. aumenta o meu tbm.,neutro
Tenho o cartão À uns 3 a 4 anos e venho pedindo aumento desdo  começo do ano e agora me deram um aumento de $150 reais. Sério o que compro com $150 ?,negativo
O meu nunca aumentou. tenho cnpj de mais de 10 anos! Sou um mau cliente?,negativo
Já não posso dizer o mesmo.já estou com o cartão a mas de 3 anos e faço tudo oq vcs ditaram.já pedi o aumento do meu limite por varias vezes.mas sempre negaram.gosto mt do Nubank.mas pretendo desativar pois Tenho outra bandeira q me liberou um crédito bem melhor....,negativo
Só queria sair dos 400. do usado a quatro meses e ainda não aumentaram. minha irmã está usando ao mesmo tempo que eu e já aumentaram o dela.,negativo
Obrigado por não aumentarem meu limite sempre que pedi ????,positivo
Já tô pra desistir de pedir aumento. Já tenho a quase um ano e até agora nada. toda vez a mesma resposta computadorizada.,negativo
6 meses de uso.,neutro
Estou amando! Aqui em casa todos temos o Nubank. fui a última a adquirir e mesmo bancando os filhotes o meu limite é o menor. ????. Um dia chego lá...,positivo
Parece piada. mas vc @nubank  me deram um cartão 50 reais de limite. é brincadeira né?,negativo
@rafaelmacedohe,neutro
Não tenho o q reclamar. é um dos melhores  cartões de crédito q já tive. O limite ainda é pouco. porém só tenho apenas,positivo
Eu já cansei de pedir aumento e até agora nada!! Isso que eu pago em dia e nunca atrasei nenhuma fatura!!,negativo
@fellipe.orn ai ó. era extremamente o que tu tava falando ontem. O nubank ta te poupando de ter o nome sujo. E de nao se individar. Kkk,neutro
preciso comprar uns móveis para minha casa e não consigo por conta do baixo limite e olha que nunca atraso meu pagamento. pelo contrário. na maioria das vezes pago adiantado! bem desanimador...,negativo
Tmb aumentaram meu limite sem que eu solicitasse. então eu estou só o Ferdinando do Vai que Cola  eu não tenho li mi tes!!! Ahahahahaha ??????,neutro
Não tenho nenhuma restrição no CPF. porém não fui aprovado para crédito.,negativo
@nubank aumenta o meu limite para eu abrir mão dos outros cartões e ficar somente com o roxinho.,neutro
Nubank me ajuda aí eu viajo pra caramba a trabalho. um platinum ia ser uma mão na roda pra mim. quais as chances? ??,neutro
Por que demora tanto pra poder solicitar um cartão de crédito?,neutro
Faz quase 1ano que o meu não aumenta,negativo
Aumenta meu limite. quero comprar meu notebook para ESTUDAR. @nubank! ??,neutro
Vcs nem um cartão de 400 liberou pra min ??,negativo
Sempre pago minha fatura antes msm de fechar e nada de aumentar meu limite,negativo
Boa tarde como faço o cartão,neutro
Aí @gustavosouzaffc . segredo pra aumentar seu limite,neutro
E eu aqui esperando meu limite chegar um valor legal pra cancelar meus outros cartões ??,neutro
O meu já tem mais de 1 ano q aumentaram o limite. ainda é muito baixo.??,negativo
Serviço e atendimento nota 10!,positivo
Pago sempre em dia. as vezes até antes do vencimento. Mas meu limite não aumenta . Hoje tenho R$ 3.450.00 mas queria mais ?? já tenho o cartão há quase três anos .,negativo
Kkk até parece que é assim minha esposa tem o mesmo limite tem mais de um ano.já concentrou gastos deixou dinheiro na conta. nunca atrasamos nenhuma fatura e continua no mesmo limite. Aí ela pediu um cartão no Credicard de cara o dobro do limite. Está inteligência de vcs é uma piada.,negativo
Recentemente eu precisei de mais do que meu limite atual. infelizmente me foi negado. Consegui fazer a compra em outro cartão de um terceiro. mas gostaria de poder usar somente o meu cartão do nubank. Fora isso. tem funcionado maravilhosamente bem para mim.,negativo
O meu roxinho ainda não chegou aaaaa. estou ansioso,neutro
O melhor de todos! Um dia terei o privilégio de ter esse cartão na minha carteira ????????,positivo
????,positivo
@nubank libera meu convite.. cansada de me humilhar pra você,negativo
Melhor cartão. eu recomendo????????????????,positivo
Preciso comprar um celular novo. @nubank aumenta o meu limite ! ?? Se não vou ter que comprar a vista,neutro
Mas quando vão  aumentar  meu limite mesmo ??. já concentrei quase todas minhas dispensas no cartão e nada ??,negativo
Aaah como eu queria aumento. 4 meses e não sai dos 500.00 :.. Sempre pagando adiantado. me ajuda aí @nubank,neutro
Fui aprovado a ter o cartão recentemente. meu limite é baixo mas digo na esperança que logo irá aumentar ?? E mais ansioso ainda pela aprovação da conta PJ pra concentrar todas minhas movimentação na NU ????,neutro
@binabrilhantemag agora entendi como eles procedem kkkkk lembrei de Hugo c o seu cartão kkkkk,neutro
Se tá ruim pra vcs imagina  pra minha amiga que fez o cartão e ganhou 50 reais de limite.,negativo
O meu nunca aumentou ??,negativo
Meu limite inicial foi 1.650.00 foi aumentando até chegar em 4.900.00. sem eu pedir. Pago uma parte antes de vencer e o restante pago em dia. Este cartão é perfeito!  Não tem outro melhor!,positivo
Aumenta o meu tbm,neutro
O meu tem 1 mês que estou com o cartão De crédito. mais me liberaram muito pouco. 50 reais só.  Fiquei triste. espero qur aumente bem mais.  mesmo assim amoo meu roxinho??????,negativo
Eu quero um aumentooooo. nunca consigo. já vai fazer 1 ano,negativo
Esperando aprovaçao ????????,neutro
Vocês irão disponibilizar algum dia venda para tesouro direto?,neutro
Um dia eu chego nos 5 mil ????,neutro
Meu Deus! Isso não é um cartão de crédito! Que sonho. Parabéns @nubank ????,positivo
Se aumentasse meu limite eu. não precisaria ter outros cartões. faz essa aí. já estou a meses pedindo aumento é nada.??,negativo
@otavio7247d,neutro
Nunca fui tão grato por ter que esperar mais de um ano pra meu limite aumentar kkkkkk chorei mas hoje agradeço,positivo
Muito triste pq não consigo tirar meu cartão ??,negativo
Até o momento não foi aprovado minha solicitação,neutro
a @nubank sempre se preocupando e fazendo o melhor para os seus clientes ????????????????????????????????,positivo
Tenho fé que ainda saio dos 400.00 reais de limite! ??,neutro
Depois de  um ano de NUBANK e passar a utilizar a NUconta meu limite subiu além de minhas expectativas. parabéns NUBANK pelo profissionalismo.,positivo
??????????,positivo
Melhor cartão de crédito do Brasil !,positivo
@lclucampos eu amo uma instituição financeira,positivo
@nubank Não quer aumentar meu limite... ??????,neutro
Mto amor pelo meu roxinho não  troco por Nada!! ????,positivo
@vinicius_pacha,neutro
Tg,neutro
@nubank aumenta o meu limite sou muito organizada. não me endividou.,neutro
Menos o meu. uso pq gosto do roxinho.. mas ainda tenho q usar outro por causa do limite. me valorizem por favor kkk,negativo
Não tenho oq reclamar. Sempre que precisei aumentaram meu limite. Agora estou com um limite que supre minhas necessidades. Amo meu roxinho e não troco ???? Obrigada @nubank ????,positivo
Nada a reclamar do aumento. comecei com R$ 700.00 e em 7 meses já to com R$ 2.150.00. O melhor cartão @nubank,positivo
Tenho um cartao de debito mais eu preciso de um de crédito,neutro
Pois eu pago super em dias. nunca atrasei e vocês nunca aumentam ???????,negativo
Eu preciso muito do aumento. Já melhorou. porém não é suficiente. preciso pedir cartão dos outros emprestado para fazer pedido de maquiagem. pois sou revendedora e o nubank não aumenta meu limite ??,negativo
Melhor cartão!  Roxinho é demais,positivo
Não saio dos 800.00 de limite. Como que vou comprar meu celular desse jeito. dona @nubank ? Kkkkk,negativo
Comecei com 500 em 2015 e hoje tô com 12.500 hahahaha cêis são é doido. ainda bem que aprendi a ser controlada EUIOEUIEIIEOEUEOE,negativo
eu queria um limite bom apenas para comprar meu computador...,neutro
Estou há 7 meses sem aumento de limite :(,negativo
Em três meses fomos de R$600 pra R$950. Tudo certo ???,positivo
O melhor de todos ????????,positivo
Estou sem dividas. aumenta o meu ahahahah ? ? ??? ??,neutro
Desisti faz tempo. sempre tentei fazer o pedido do cartão e nunca autirizam pra mim. tenho nome limpo. trabalho de carteira assinada e n entendo pq n condigo. conheço pessoas q n tem emprego fixo. e eles autorizaram #trsite ??,negativo
Realmente e sempre uma adrenalina kk,neutro
Preciso de um aumento ele é bem menor que minha renda e gostaria muito de viajar usando o cartão mais infelizmente não consigo nem comprar uma passagem ainda ??,neutro
Não tenho o que reclamar do meu limite. Sempre aumentam. mesmo sem eu solicitar.,positivo
Já pedi aumento e não consigo. pago tudo antes da data,negativo
Alguém tem convite do Nubank para enviar?,neutro
@juanfernandes99,neutro
?? desculpa eu não atraso pq eu quero ????????,neutro
Amo esse roxinho. O melhor de todos. De pensar q pagava anuidade cara no Itaucard??????????????,positivo
Tenho limite ótimo. mas procuro não gastar tudo. Como sou profissional liberal. nunca se sabe no próximo mês. Amo o Nubank. roxinho. Indiquei para vários amigos de confiança. ????????????,positivo
Por isso eu amo o @nubank! Sempre pensando no cliente e na saúde financeira dele.,positivo
@dantasjoaov,neutro
de 500 reais o meu foi pra 1.700. não reclamo mais ??,positivo
nubank. eu só queria um cartão de crédito ??,neutro
@brunokronem nubank pensando em vc,neutro
Pedi 3x e nada. ai DO NADA Aumentaram meu limite. ??,neutro
Não é tão fácil hein.  Ehheeheh o meu demorou. Agora tá tranquilo,neutro
Eu pago minha fatura no dia do vencimento pra deixar meu dim dim rendendo na NuConta por mais tempo ??,neutro
Ganhei aumento mês passado sem pedir. Esta justo e do meu agrado.,positivo
De um amigo deram 50 reais de limite kkkk Cinquenta reais ..... Vocês estão loucos né ???,negativo
Nesse ponto não posso reclamar do @nubank . no começo não entendia o porque do limite baixo (500 reais na época) apesar de renda boa. Hj tenho limite bom e vejo que na época os 500 foram para o bem da minha saúde financeira. Valeu @nubank ??,positivo
Adoro esse roxinho. Vou partir para o reward em breve. pois o meu limite já permite projetar meus gastos no cartão e acima de R$1600. 00 de gastos já começo a obter vantagens nesse programa. Show de bola nubank. Sou defensor da marca de vocês ??,positivo
??sempre pensando nos clientes... sou grato.. ???? Sempre @nubank juntos????,positivo
Kkkkkkkkkkk eu também só 50 meu Deus kkkkkk????,neutro
Nubank aumenta meu limite....,neutro
Queria tanto um aumento @nubank .espero um dia ter esse aumento.,neutro
Quando chegou meu cartão achei o limite baixo mas em 3 meses aproximadamente meu limite triplicou agora estou satisfeita. ??????,positivo
Acho que a solução é não pedir pra aumentar o limite. eles só aumentam o limite de quem não pede kkkkk,negativo
Nubank aumenta meu limite por favor ??,neutro
@kemuelbarbosa e eu pensando que meu limite era baixo KKKK tem quem tenha só 50 KKKK,neutro
@gabis_nunes ai. como funciona a análise do limite,neutro
Meu limete veiio abaixo de 100 e já fiz compras mas ainda nada de alimento ja fiz solicitação mas nada,neutro
@iankatalita . fica a call ai kkkk,neutro
Libera meu cartão. o limite a gente ver depois !,neutro
Comecei com 600.00 de limite. Demorou um ano mas quando aumentou foi para 4500.00 ?? não troco por nada esse cartão ???????,positivo
Aguardando o meu aumentar conforme o pedido feito. Já no limite para não entrar dívidas altas.,neutro
Eu tenho controle. sei usar bem o cartão. mas gosto de pedir aumento de limite ??,neutro
Preciso de 2.500 de limite pro meu trabalho e pra minha empresa oq eu faço ??,neutro
O meu limite de 50 reais Kkkkkk humilhação nu. tem gente que eu conheço que começou com o limite bom e eu me lascando com 50 reais,negativo
Amo.amo.amo.meu limite tá quase perto dos $5.000 né@nubank ??????????,positivo
Estão devendo nessa em Nubank.... Pago em dia. consumo entre 80 a 100% do limite. uso a NUConta.... Mas cadê?,negativo
????????,positivo
@isamontibeler,neutro
Se eu insisto em pedir um limite maior é pq eu to podendo pagaaaaaar. Dps d cansar d insistir pedi foi outro cartão. o do inter. q me da mais benefícios até e um limite beeem melhor,negativo
Amo esse roxinho ????,positivo
@nubank desde que recebi meu cartão (há 3 ou 4 anos) nunca fui agraciado com um aumento de limite ??,positivo
@brunogabrielrr,neutro
Péssima justificativa @nubank,negativo
Graças a Deus eu to satisfeito com o meu limite haha,positivo
Gosto mais ainda,positivo
Estou satisfeito com o produto. mas lendo aqui. gostaria de salientar que o Score do Serasa é bem discrepante em relação ao Boa Vista. na verdade chega a dar uma diferença de até 50%. sendo avaliado os mesmos conceitos...quem tem cadastro positivo ativo em ambos entende do que estou dizendo.,positivo
Disciplina é tudo ??????,positivo
Oi da minha esposa ta  de 50 reais até hj?? Oia mos,neutro
E qd a gente faz td isso mas o nubank n aprova a gente ?? ainda bem que o banco Original me recrutou ????,negativo
