comentario,polaridade
Amo a Nubank. estou a 4 anos com este cartão porém nessa questão acho que vocês deixam a desejar. uso o meu caso pessoal pra ter está opinião pois quando entrei na Nubank em 2015 tinha um limite de 500 reais e nestes 4 anos. pagando as contas em dia e atualmente até antecipando. tive aumento de apenas 2K. sendo que ganho mais do que isso. Vejo relatos em grupos do cartão de pessoas até desempregadas entrando e já ganhando um limite alto ou do nada a Nubank aumentando significativamente o limite da pessoa. Acho que nesta questão a Nubank é relaxada.,negativo
@nubank NUNCA TE PEDI NADA. AUMENTA MEU LIMITE.,neutro
Melhor cartão. Minha ex Cunhada fez mas foi débito. tem como passar pra crédito?,neutro
????quero um tem ano que peco e nunca me aprovam??????,negativo
Cartão maravilha???? ??. eu só queria chegar limite de 3.000 . Nubank coopera cmg ??,positivo
Só queria um limite de 50 reais kkk,neutro
Meu mar são vcs ??.,positivo
@diogotommaz,neutro
Cumpro todos esses quisitos e mesmo assim não sou atendido.,negativo
Mano meu nunca aumentou :@,negativo
Ando sempre em dias com meu Roxinho agora só quero mais um pouco de limite ??,negativo
O bom é que em apenas 1 ano meu limite aumentou duas vezes. isso Pke sei controlar muito bem meus gastos. É sim isso ajuda muito . Muito obg ??,positivo
????,positivo
Cancelei os outros cartões e não me arrependo até agora. Continue assim nu  sempre surpreendendo cada vez mais ????,positivo
Muito bom o dia que não cuidei o limite e fiz uma compra acima do que ainda restava de limite. era menos que 20 reais o que faltou. e a nubank aceitou a transação mesmo assim. eu fiquei muito feliz porque era importante ter feito o pagamento kkkkkkk,positivo
Sou cliente a 2 anos. nunca atrasei fatura. sempre gasto mais 60por cento do meu limite. todos os meses e mesmo  assim nunca aumentaram meu limite. Ja liguei para o atendimento e ninguém entendeu oq acontecia com meu caso,negativo
Comecei com 500 apois pagar a primeira fatura foi pra 2.500 ?? bgd @nubank. O melhor ????,positivo
@faverosarah,neutro
#nubank?? o melhor?? ????????????,positivo
Varios bancos te dão limites altos. pagando ou não anuidade... e você tem o limite que você precisa comprar tal coisa que você precise. Mas tem meses que não aumentam meu limite pois preciso fazer tais compras específicas e não consigo. Se fulano pagar ou não (claro que não faz mais que sua parte pagar o que gastou). joga o cpf de fulano no spc e pronto. Mas fazer o que ???????,negativo
Tou tentando aumentar meu limite ah tempão e não consigo?,negativo
Já pedi muito pra aumentar meu limite ! Desisto ?? pra quem vai casar final do ano precisar de um limite maior no cartão e não ter ??,negativo
POR FAVOR @nubank,neutro
@nubank Tentei atualiza minha renda como dito aqui e não foi.,negativo
Aguenta o meu pra 6k @nubank,neutro
Tentei pedir aumento de limite umas 5x para terminar minha reforma mas não deram. A Neon aprovou ???????,negativo
Usar a NuConta ?? ajuda na aprovação do cartão? ??????,neutro
Melhor cartão ! ??,positivo
Melhor cartão do mundo! ??,positivo
Muito bom graças a Deus pago minhas contas tudo em dias nunca gostei de atrasar nenhum pagamento meu. N deu trabalho a nubank aumentou meu limite estou esperando só aumentar mais um pouco pra poder eu me desfazer dos outros q ainda pago anuidade. Muito obrigado nubank ????,positivo
Está horrível acho q n ajustei no inicio e meu limite esta de 50 reais totalmente desproporcional a minha renda !!,negativo
Gostaria de usar só o Nubank mas o limite é muito baixo hj. O que acha de vcs olharem o histórico de gasto e pagamento do meu outro cartão de mesma bandeira. assim vão ver que podem aumentar meu limite sem riscos e migro tudo pra vcs ??,negativo
Mesmo seguindo as recomendações não consigo o aumento de limite ??????,negativo
O melhor cartão. ??,positivo
@nubank  Um pena meu app não permitir atualizar a renda ??,negativo
@willy_teixeira,neutro
Ain ?? até choro,positivo
Vcs são incríveis! Obrigado pela transparência com nós. @nubank.,positivo
Me aprovem mds ??,neutro
??????,positivo
Nubank aumenta o limite da minha namorada pra gente alugar o carro pra ir pra um casamento por favorrrrr,neutro
Ja indiquei 5 pessoas e 3 ja fizeram espero também cooperar pela vida financeira das pessoas que pagao abisurdocde taxas abusivas . Eu sofria hoje nao mas gralas ao NU????,positivo
Amo o meu nubak... melhor cartão q já tive... ??,positivo
??em novembro eu farei dois anos de roxinho . comecei com 800 e hoje ele chega a 1.750e qiero mas . porem sempre no controle dos gastos tamo junto????,positivo
Tentando conseguir cartões pra meus irmãos. nunca usaram bancos .nem seus cpf's .não tem restrição algumaaa. porém. não aprova nada. só a conta. nada de cartão de crédito.,negativo
no começo aumenta mas depois parece que agente deixa de existir  já concentrei meus gastos todos no nubank já usei todo limite varias vezes e nada e nunca atrasei uma fatura tive que pedir o pag e agora estou concentrando a maioria dos gastos nele,negativo
@nubank aumenta meu limite!,neutro
Cartão maravilhoso.. em 3 meses aumentou meu limite ????,positivo
@fernandojunior84,neutro
????????,positivo
@nubank me manda uns brindes rsrs. nunca te pedi nada,neutro
@juanpetrus,neutro
Tenho cartão Nubank limite de 850.00 e um digio de 4.000.00 essa análises de vcs não está sendo legal não,negativo
Sou cliente a mais de 1 ano. pago minha fatura antes do vencimento todos os meses. ja perdi a conta de quantas vezes pedi o aumento do limite e nada,negativo
Comecei com 400.já aumentaram p. 800??????,positivo
??,positivo
@nubank o meu limite estacionou. nunca mais tive um aumento????????,negativo
Se fosse verdade meu limite seria mais de 5000 e não 1250 kkkkk ?? tem gente que ganha pouco e tem mais do que eu vai lá entender.,negativo
Se fosse verdade meu limite seria mais que 5000 ???? tem gente que ganhar menos do que eu e tem mais limite. vai lá entender. porém o Nubank é ótimo.,negativo
O meu já tem 6 meses c 400 reais até já desacreditei desse aumento ??????,negativo
Infelizmente já solicitei várias vezes. e minha solicitação é recusada. em outros 2 cartões. meu limite é o dobro que tenho na Nubank ??,negativo
sandraseld cartão de crédito que não quer te enterrar em dívidas. você já tinha visto isso antes?,neutro
Certíssimo.,positivo
Viu por isso amo tanto. acabei de sair de um cartão com limite de2100.00 pro de vcs que tá com limite de 700.00 amo vcs ??????????. vou ter que arrumar uma blusa roxa pra demonstrar tanto amor,positivo
O melhor roxinho do mundo ??,positivo
??,positivo
Podem aumentar a vontade. gastarei só o que posso.,neutro
Infelizmente não tenho um limite compatível com meu gasto mensal. média de 5000 por mês...,negativo
Meu queridinho ??,positivo
Essa escolha de limite é top. Para mim funciona muito bem,positivo
??,positivo
Eu tenho um limite baixo. mas ja aconteceu de ter um imprevisto e não conseguir o valor e ter que parcelar a fatura. O limite é baixo. mas sou muito feliz com meu roxinho ??,positivo
Cuidou tão bem da minha saúde financeira que eu até pedi outro cartão com mais limite ??,negativo
Amo meu roxinho ????,positivo
To só esperando vcs aumentar  o meu limite. deixei de comprar o tênis q eu queria pq não tinha limite. mas eu tinha dinheiro??,negativo
Melhor ?? que tenho. aumentem meu limite!! ??,positivo
Roxinho e show meu primeiro veio com 1600. depois quase dobraram foi pra 3mil. eu pago sempre antes e mantenho minha economia na nu conta. Nota 10,positivo
Pena q não consigo??,negativo
Um dia saio dos 50... ????,neutro
E meu fez 1 ano da última vez que aumentou meu limite??,negativo
Aumenta meu limite,neutro
@biaa_bertelli,neutro
Vocês são incríveis,positivo
Infelizmente disso tenho o que reclamar do roxinho querido ?? @nubank aumenta meu limite ?? nunca te pedi nada!,negativo
@jhenifferlira,neutro
Meu limite é baixo e uso bastante o meu cartão @nubank pago minhas contos sempre em dia e sempre que peço aumento não tenho e aí nubank!? Já recebi proprosta de outro banco virtual,negativo
Um dia eu saio dos 50 reais kkkk??,neutro
Tenho o cartão nubank faz uns 8 meses tive um aumenta de 100 reais durante este tempo todo. Estou precisando de que aumentar mais uns 200 reais... a diferença estou gastando em dinheiro mesmo,negativo
Qro ser cliente nubank tb! Como faço?!,neutro
Problema é enviar foto da nova renda e não atualizarem no app...,negativo
Meu amor roxinho??????,positivo
Ja estou na minha 3 tentativa de ativar a minha função credito e nunca me aprovam ?? mas nao desistii ainda!!,negativo
Eu nunca saio do meu limite de 400 reais mas esta bom é um limite justo para meus gastos no mês. apesar que eu acabo gastando muito mais e fico antecipando os pagamentos para liberar o limite por isso acho que vcs poderiam aumentar um pouco mais meu crédito kkkk #aumentameulimitenubank heheheeh ????????????,neutro
Desde o dia que peguei meu Nu. pago sempre. sempre mesmo antecipadamente. porém. de uns tempos pra cá. mesmo minha renda tendo aumentado. e eu tendo atualizado. toda proposta de aumentar o limite é recusada. Nunca atrasei. sempre pagando total e antecipado.,negativo
Melhor do melhor do mundo ??,positivo
Meu roxinho. Melhor que muita gnt da família ??,positivo
Ahh Nubankizinho ????,positivo
Meu Love ??,positivo
Um sonho trabalhar nessa empresa...,neutro
Aumente meu limite preciso comprar meu celular ????,neutro
??????????,positivo
Precisando aumentar o meu. ainda não me deram essa moral e sou bom pagador.??????,neutro
Melhor de todos ??,positivo
Adoro o Nubank! O limite é perfeito e nos auxilia a controlar os gastos. Percebo que o meu valor máximo disponível tem aumentado. mas ainda assim. uso apenas 30-40por cento dele. Depois de 2 anos sem ter interesse em um cartão de crédito e ter cancelado em um banco comum  me sinto feliz com o do Nubank.,positivo
Estou amando meu roxinho.só queria um pouco mais de limite.rs,positivo
Me dá cartão de crédito nubank! Pelo amor... cansei de ser negada !!!E não tenho dúvidas kkkkkk,negativo
@nubank pago todas as faturas tudo certinho já tenho faz 1 ano e ainda não aumentaram meu limite :( minha mina no segundo mês vocês aumentaram em 60% o limite tão de sacanagem comigo kskskskksk,negativo
Estou pedindo faz tempo e até hoje não aumentaram.  cansei de pagar adiantado .pago no dia...Mas não aumentam .No meu caso. tenho uma renda comprovada no holerite e outra que ganho por fora. que não tenho comprovação em papel. O cartão é bom.mas estou pensando em fazer outro.pois meu limite é muito baixo.não consigo realizar algumas compras maiores pelo cartão. pois não tenho.limite para comprar...acabo tendo que guardar o.dinheiro e comprar a vista...Aí o cartão acabou não sendo tão útil quanto eu esperava,negativo
@matheus21freitas,neutro
desculpem minha ignorância. ainda não estudei as opções da Nubank. o cartão é ou pode ser internacional?,neutro
Estou in love. ?,positivo
Já tenho ele a 4 meses pagos bem antes do vencimento nunca duvido mais de 2 x . e uso todo o meu limite de 400 . todo mês e nunca aumentaram 1 real de limite . peço o aumente e já negam logo de cara . isso é muito chato implorar por limite de cartão de crédito . tenho mais 2 cartões e nunca tive esse problema,negativo
Sou doida por meu roxinho ????????,positivo
Amo ????????,positivo
E nada,neutro
Aumenta o meu pago antecipado,neutro
Comecei com 750.00 há 2 anos. hoje já são mais de 8 mil. Amo demais ??,positivo
Em 2 meses aumentou para 650 reias ?,positivo
Tenho cartão limite auto no Santander. nem sou correntista nem tenho poupança mas estou pensando em ser. Pois vocês não aumentam em nada meu limite. mesmo estando tudo ok com meu CPF e score legal... :(,negativo
Aumenta o meu também tô querendo usar mais o cartão e o limite tá super baixo.,negativo
Mesmo assim queria aumentar meu limite ??,negativo
@clallsilva,neutro
Quero mais limite! ??,neutro
Seria interessante se tivéssemos acesso a nossas estatísticas de gastos e o total que já economizamos com adiantamentos de parcelas e rewards. Outra coisa importante seria se o extrato da nu Conta fossa mais parecido com um extrato comum.,neutro
Amo meu Roxinho,positivo
Pra ficar perfeito libera os saques gratis e boletos para depositos ilimitados ou pelo menos uma quantidade melhor. pq apenas 10 boletos está pouco. ?? #ficaadica,neutro
Kjkkk. só tá faltando aumentar o meu pelo visto. complicado pagando fatura sempre acima de 600 reais já fiz mais de 10 tentativa pra aumentar pra 3.000 porém nunca vai,negativo
Aí sim em @nubank .. Como eu faço para receber algum presentinho de vocês? Aqueles mimos? Sempre pago em dia as faturas seria interessante já que sou cliente a tempos. Vlw obrigado por serem Foda! Kkkk,neutro
Pensa em mim. que eu to pensando em você ??,neutro
@nubank pois o meu faz tempo que não aumenta. só uso ele. chego até o limite. pago sempre o valor total da fatura e sem atraso... e ainda tem uma boa quantia na conta. rendendo...mas. qualquer hora eu troco e aí resolvo tudo né!,negativo
Meu limite é completamente incompatível com a minha renda. Meu limite no outro banco é 10X mais. Aí. como o limite é pequeno. não consigo comprar nada nele. e acabo usando pouco e aí vocês não aumentam o limite. Já pedi várias vezes e nada. =.,negativo
E tem como não amar esse roxinho ????,positivo
@caiio__alvees,neutro
Aumentou o meu de 900 para 14.300 ??,positivo
um dia eu saiu dos 50 reais kkkk ????,neutro
Melhor cartão ????. sou cliente a uns 2 anos e NUNCA tive algum problema com a @nubank app fácil de ser manuseado. ótima segurança... E um excelente limite de crédito concedido. estão de parabéns ??????,positivo
@edinhocf ??,neutro
@augustamariac,neutro
Meo limite e só 50 reais que triste ??.. @nubank  mim ajuda pff gosto tanto desse roxinho lindo...,negativo
A @meudigio me deu R$2600.00 de limite enquanto a @nubank me deu R$ 200.00. Isso com a mesma renda e solicitados na mesma semana. Parabéns @nubank !!!! ????????,negativo
Amo ??,positivo
Me deram 50.00 de limite eu achei top ??????,positivo
Acho q vcs deveriam lançar um limite para compras específicas. tipo se a pessoa precisa comprar um celular. iPad. algo mais caro. ter um limite para isso. sem afetar o de compra. Ajudaria muito. cancelei meu Amex e agora não consigo trocar de celular @nubank ajuda nós ????,neutro
Não uso o total do meu limite mas mesmo assim poderiam aumentar.a gente nunca sabe quando vai precisar.obs:pago sempre antes do prazo o valor total.mas ainda assim é um excelente cartão.,neutro
Só eu que não consigo a função crédito ??,neutro
Sou muito fã de vcs!,positivo
Um dia com fé em Deus o @nubank aumenta o meu limite de 600.00 ??,neutro
Meu cartão nunca chegou,negativo
Melhor coisa q aconteceu. meu roxinho!!!! ??????,positivo
????????????????????????????,positivo
??????????,positivo
Sempre antecipo faturas e compras parceladas. mantenho renda atualizada e meu limite é o mesmo há anos. E sempre que preciso em eventuais necessidades (viagens por exemplo). é negado o aumento. Não concentro minhas compras por conta disso e porque não acho o Rewards atrativo. Logo. concentro em outro cartão que me disponibiliza melhor limite e me atende quando preciso (de aumento em caso de viagem ou compra de algo de valor mais alto) e com programa de pontos sem anuidade. Então deixo de usar mais por conta disso. Vejo gente com renda 1.3 da minha. atrasa fatura e com limite maior. Logo. difícil entender os critérios. Fora isso. em questão de praticidade e atendimento. o @nubank é o melhor. realmente.,negativo
Aumenta o meu limite ai??????sempre pago antecipado tudo direitinho .O limite é muito baixo??,neutro
Apesar do NUBANK ter mim dado pouco limite de crédito eu estou muito feliz por ter esse cartão que é show demais!!!!espero que em breve aumentem  meu limite!pois estou pagando td certo e até muito antes do vencimento...??????????,positivo
Nosso também. Preciso urgente ??,neutro
O meu limite de R$ 50.00 ??.. mas tudo bem. como eu queria meu roxinho ????????,positivo
Eu sempre pago o meu em dias. e nunca mais aprovou o aumento..,negativo
Gasto todo meu limite . nunca atrazei nem um pagamento nunca parcelei. por que não consigo aumento de limite??,neutro
Meu tbm,neutro
@bianca.macari,neutro
Eu não troco meu roxinho por nada ????????,positivo
Olha como meu bebê se preocupa ??,positivo
Isso ae é pra não tomar calote,neutro
Comecei 1.700 fiz a mudança ontem pra 2.200 bom d++ ????,positivo
Piada. Já vi no Twitter vcs RT em gente desempregada tendo limite aumentado... pago minhas faturas em dia. 100%. as vzs até adiantado... meu limite é o mesmo faz 4 anos...,negativo
Poderia aumentar o meu né... 50 tão ta foda kkkkkkk,negativo
@joiiice_ramos ??,positivo
Triste que não liberaram limite algum. Logo eu. que sempre tive limites na concorrência?!,negativo
Melhor cartão meu xodó amo e não troco ????,positivo
Como funciona.  me mandaram o convite mais aí pede pra compartilhar no Whatsapp aí eu compartilhei e nada,neutro
@nubank esse post me define??,neutro
Se aumentar meu limite. mando o Itaucard pra pqp,neutro
@__kajota__  veiaca,neutro
Meu cartão vai fazer 1 ano. tenho estourado quase todo mês o limite. pagando tudo em dia e até agora nada... até o bb já aumentou o meu limite e o nubank nada.,negativo
??????????,neutro
@nubank meu limite total aumenta somente se eu solicitar? ??,neutro
Melhor cartão ????,positivo
@1elaine.ramos  olha ai pq seu limite veio aquele,neutro
Eu nunca precisei pedir aumento de limite. sempre sou surpreendido com os aumentos que o nubank faz pra mim ????,positivo
Recebi meu cartão mais o limite que tenho não condiz com a minha renda.pretendo não usar porque não consigo fazer nem a dispensas básicas do mês.obrigado mais não dá ?,negativo
@alexsandrofb,neutro
Sigo todos os passos. tenho ate colocado cpf na nota. amo vocês. Eu só queria um aumentozinho ??,neutro
Eu recebi meu cartão mais o limite não está,neutro
Recebi meu cartão de débito hoje. Aff como é lindo ??,positivo
O meu já faz um bom tempo que estar apenas com 50 reais de limite até minha renda já boa mas nada de meu limite subir ??,negativo
Muito legal vcs pensarem no consumidor desta maneira. Aprendi com minha mestra das finanças @dominesuasfinancas Lu Fiaux que é uma forma de proteção mesmo para não nos endividarmos. ????,positivo
tenho o cartão desde 2016. e desde 2018 não recebo limite! não atraso. compro bastante. e nada de liberar o limite. isso me entristece!,negativo
Kkkkk literalmente @iisa_belaqueiroz,neutro
Nunca tive surpresas com esse cartão. e já tenho ele já quase 2 anos.,positivo
O meu tá até bom. mas poderia ser melhor ??????,neutro
Nunca consegui aumento no limite. e tenho vários outros cartões que aumentam meu limite e o Nubank não!,negativo
E quando seu chefe fala pra vc. se a gente fizesse um cartão de crédito (da nossa empresa) vc usaria? E eu falasse: não. Não saio do meu nubank ... #agoratocommedo,positivo
Tentei aumentar meu limite no nubank umas 5x para as reformas do meu apartamento e não consegui. Fiz na Neon ???????,negativo
Vocês pararam de aumentar meu limite kk acho que deixaram de gostar de mim como cliente,negativo
Estou ansioso pra chegar logo o presente que @nubank vai me enviar! ??,neutro
Bom o meu cartão está bloqueado ainda... Vou quitar um cartão d eu pai para poder começar usar o meu! Aí sim terei alguma posição se farei parte dos que estão felizes ou se farei parte dos que estão decepcionados...,neutro
Sempre o melhor ??????,positivo
Vocês estão é certíssimos!,positivo
Mentira isso aí! Já segui todas essas dicas e nada de aumento. sou cliente a quase 2 anos. nunca tive 1 aumente de limite. nunca atrasei 1 dia de pagar. pelo contrário sempre pago antes... ps: meu score esta na casa de 900 . e tenho outros 6 cartões com bom limite. pra que continuar usando esse cartão com um limite incompatível com meu perfil? Lamentável @nubank ??,negativo
Recebi meu cartão.as confesso qir já tô vendo em algumas postagens na web sobre o Nubank que já tá me preocupando... Kkkkkkkkkk,negativo
Trenzinho representa meu salário que sobe e despenca sem dó ??????,neutro
Fiz o cadastro mais ñ fui aprovada ????,negativo
Sempre peço para aumentar meu limite para quando eu precisar ter... Mas é ótimo a gente poder ajudar para ter controle e não gastar demais??????,positivo
Crlh eu amo vcs ??,positivo
@nubank aumenta meu limite!!! Quero comprar um nintendo switch!!! Hahaha sério! ??,neutro
Pior é quando não da nem 100 conto de limite.  acho que deviam confiar pelo menos um pouco nas pessoas.uma vez que as pessoas confiam o dinheiro delas à vocês... devia ser uma via de mão dupla...,negativo
A  da minha mãe ate agora não alimentou.. sempre pago em dia,negativo
Negaram mais pra mim. fui para o @bancointer ! ??,negativo
Amor dá minha vida ?? ??,positivo
O Melhor!!!??,positivo
??,positivo
@magno_ribeir,neutro
@anisiopomponet,neutro
Melhor do mundo!!????,positivo
Compro...pago...nunca parcelei e não saio dos 1000...aff...ja tirei outro cartão e em,negativo
Quero muito??,neutro
@britobeatriz_0,neutro
Me atiça que eu gosto do perigo??????,neutro
Como vai aumentar o limite que eu nao tenho ?? ????,negativo
@camillasampi vc,neutro
E quando nunca nem conseguiu a função crédito? Kkkk,negativo
Sem dúvida é a empresa com o melhor cartão de crédito e a melhor conta digital!!! ?? #roxinho,positivo
Lindoo????,positivo
Consegui esses dias o roxinho????,positivo
Comecei com 1900 agora 4300 tá melhorando ????,positivo
Meu score e 821 . tenho cartão a 2 anos e não sobe o limite nem com reza braba. parei ate de usar o cartão ..,negativo
Melhor cartão. impossível! Parabéns ?????? Muito satisfeito!!!??,positivo
Nubank DIMINUA o meu limite. não aguento mais gastar dinheiro,neutro
Não existe outro melhor. Apenas amo ??,positivo
@anndre_de ??????,neutro
Eu gostava do cartão. mas justamente por questão do limite e das tentativas de aumento negadas. mesmo com comprovações e tudo mais. tive que sair. Entendi que a única opção de aumento. seria o pagamento adiantado das faturas. Se fosse pra pagar adiantado teria feito a compra à vista ?????????,negativo
O meu ainda não aumentou mas tô muito satisfeito com o trabalho de vocês ??????????????????,positivo
Cartão top. nada a reclamar. pelo contrário. faço propaganda de graça RS,positivo
Nubank. aprova meu cartão. ??,neutro
Quero brindes ????,neutro
Sua linda ??,positivo
Eu quero um,neutro
Uma empresa que incentiva o consumo consciente. nem dá pra acreditar que existe. Muito feliz com meu Nubank ??. Por mais empresas como vocês. que prezam pelo bem estar dos clientes. @nubank,positivo
A questão não é gastar todo limite.Se faço uma compra .tipo celular.TV meu limite não atende.Eu uso outro cartão pq meu limite é baixo.No momento que meu limite for suficiente eu cancelo os outros.apesar que o AMEX tbém não tem anuidade e tenho um limite bem maior que o Nubank. Pago minhas faturas em dia é valor total.,negativo
Tenho uma renda boa so me deram 50 reais de limite. Aumenta por favor,negativo
Sempre pago antecipado... .porém não aumentam meu limite,negativo
@johnnyteodoro,neutro
ta certo,neutro
Até hoje não me aprovaram ??,negativo
@michael_dsouza,neutro
??,positivo
Eu sempre faço isso e vocês aumentaram de 900 pra 1.050 kkkkkkk e olha que eu nem parcelo as compras e pago 5 dias antes do vencimento,negativo
Vcs falaram tudo. vcs me deram um limite e eu ainda baixei um pouco já para não correr esse risco. tenho orgulho de ter um @nubank.,positivo
Tenho faz 2 anos. uso todas as funções e nada do limite aumentar... aí complica!,negativo
@luizacsta,neutro
Meu único problema atual com vocês é esse. quero tanto que passe logo! Meu limite não é o suficiente para o que eu necessito e eu sigo literalmente todos os passos citados no post. Pagamento SEMPRE antes da data de vencimento. utilização total do limite. renda atualizada... Me ajudem nisso para que eu possa amar vocês 100% ??,negativo
Um dia saio dos meus 400$. tá demorando,negativo
Tenho cartão deste novembro... Sempre paguei o valor na data de vencimento. uso a nuconta... Mostro que não irei atrasar.. Estou precisando de um aumento já faz uns meses. e não me concederam ainda.. ?? Triste mas td bem..,negativo
O Melhor cartão ??,positivo
@biell_cavalcanti meu limite é alto pq eu sou perfeita mesmo,neutro
Papo furado. nubank está ficando igual aos bancos ??,negativo
Affs. só amooo????,positivo
Vcs deviam pensar em fazer uma maquininha de passar cartão ????,neutro
Fiquei triste . até com pagamneto antecipado o limite não aumentou mais . apenas consumi o valor pago  a maior e após igualar o pagamento com valor anterior não tive aumento .,negativo
Na empresa que trabalho  a maioria dos clientes usam ??NU?? a partir dai  resolvi adiquirir o meu. estou amando usar este cartão... facilitou muito minha vida,positivo
Seis meses de conta e zero de limite.será que é bom mesmo.,negativo
@mac.arteestudiodesign,neutro
Concordo com vcs em partes...o problema é quando a gente precisa comprar um determinado produto e ele custa o dobro do seu limite affs!?????? estou pensando seriamente em cancelar o meu!,negativo
só o meu que não aumenta ????,neutro
@julia.carvalhop,neutro
Me dá meu cartão de crédito ????,neutro
Melhor cartão de crédito??,positivo
Quero mais limite hahaha,neutro
Queria substituir a minha geladeira antiga mas não consigo por causa do limite. Não consigo parcelar. ?? .. se o Nubank não me conceder. vou ter que partir pra outro cartão. infelizmente. Dizem os especialistas quanto menos  cartão de crédito. melhor. #Difícilasituação.,negativo
Amo amo meu roxinho ????,positivo
